Questions,Answer,Math Problem (Bengali),Math Problem (English)
"কোন একটি বিয়ের অনুষ্ঠানে রান্না করতে বাবুর্চি ও তার সহকর্মী মোট ৪০০টি পেঁয়াজ কাটেন। বাবুর্চি প্রতি মিনিটে অন্তত ৩টি পেঁয়াজ এবং তার সহকর্মী প্রতি মিনিটে অন্তত ২টি পেঁয়াজ কাটতে পারে। যদি বাবুর্চি তার সহকর্মীর চেয়ে ২৫ মিনিট আগে পেঁয়াজ কাটা বন্ধ, তবে কে কতটি পেঁয়াজ কেটেছিল আর কার কতক্ষণ সময় লেগেছিল?","বাবুর্চী কাটে ৭০ মিনিটে ২১০টি পেঁয়াজ, সহকারী কাটে ১৯০টি পেঁয়াজ ৯৫ মিনিটে","কোন একটি বিয়ের অনুষ্ঠানে রান্না করতে বাবুর্চি ও তার সহকর্মী মোট ৪০০টি পেঁয়াজ কাটেন। বাবুর্চি প্রতি মিনিটে অন্তত ৩টি পেঁয়াজ এবং তার সহকর্মী প্রতি মিনিটে অন্তত ২টি পেঁয়াজ কাটতে পারে। যদি বাবুর্চি তার সহকর্মীর চেয়ে ২৫ মিনিট আগে পেঁয়াজ কাটা বন্ধ, তবে কে কতটি পেঁয়াজ কেটেছিল আর কার কতক্ষণ সময় লেগেছিল?","At a wedding, a chef and assistant cut 400 onions together. The chef cuts at least 3 onions per minute and the assistant cuts at least 2 per minute. If the chef stops 25 minutes before the assistant, how many onions did each cut and how long did they work?"
১০ বছর পূর্বে মিলি ও পুষ্পার বয়সের অনুপাত ছিল ৭: ১ । বর্তমানে তাদের বয়সের অনুপাত ছিল ৩ঃ১। ১৬ বছর পূর্বে মিলি ও পুষ্পার বয়সের অনুপাত কত?,১৬ বছর পূর্বে পুষ্পার জন্ম হয়নি,১০ বছর পূর্বে মিলি ও পুষ্পার বয়সের অনুপাত ছিল ৭:১ । বর্তমানে তাদের বয়সের অনুপাত ছিল ৩ঃ১। ১৬ বছর পূর্বে মিলি ও পুষ্পার বয়সের অনুপাত কত?,"Ten years ago, the age ratio of Mili to Pushpa was 7:1. Currently, their age ratio is 3:1. What was the ratio of their ages 16 years ago?"
"খেলনা গাড়ি নিয়ে খেলার সময় মিন্টু দেখলো , সেন্টুর গাড়ির সংখ্যা তার চেয়ে বেশি এবং সেন্টু কে বললো, তুমি আমাকে দুইটা গাড়ি দাও তাহলে আমাদের গাড়ির সংখ্যা সমান হবে ।সেন্টু উল্টো জোড় করে মিন্টুর থেকে ২টি গাড়ি নিয়ে হিসাব করে বলল তার গাড়ির সংখ্যা এখন মিন্টুর দ্বিগুণ । শুরুতে কার কয়টি গাড়ি ছিল ?","সেন্টুর ছিল ১০টি, মিন্টুর ছিল ১৪টি খেলনা গাড়ি","খেলনা গাড়ি নিয়ে খেলার সময় মিন্টু দেখলো , সেন্টুর গাড়ির সংখ্যা তার চেয়ে বেশি এবং সেন্টু কে বললো, তুমি আমাকে দুইটা গাড়ি দাও তাহলে আমাদের গাড়ির সংখ্যা সমান হবে ।সেন্টু উল্টো জোড় করে মিন্টুর থেকে ২টি গাড়ি নিয়ে হিসাব করে বলল তার গাড়ির সংখ্যা এখন মিন্টুর দ্বিগুণ । শুরুতে কার কয়টি গাড়ি ছিল ?","While playing, Mintu noticed Sentu had more toy cars. Mintu said, “Give me two cars, and we’ll have the same.” Sentu instead took two cars from Mintu and claimed he now has double. How many cars did each have initially?"
"বেরু গোয়ালার কাছে একটি কলসিতে ১০ লিটার দুধ এবং দুধ মাপার দুটি খালি পাত্র , একটি ৫ লিটারের, অপরটি ৩ লিটারের। সে ক্রেতাকে ১ লিটার দুধ বিক্রি করতে চায়। গোয়ালার কাছে জেডযেসব পাত্র আছে শুধু তা দিয়ে কিভাবে ক্রেতাকে ১ লিটার দুধ দেয়া সম্ভব?",প্রথমে ৩ লিটারের পাত্রে ৩ লিটার দুধ নিয়ে তা ৫ লিটারের পাত্রে ঢালতে হবে। এবারও একইভাবে আবারও ৩ লিটার দুধ নিয়ে ৫ লিটারের পাত্রে আছে আরো ঢালতে হবে যতক্ষণ না ৫ লিটারের পাত্রটি পূর্ণ হয়। পাত্রটি পূর্ণ হওয়ার পর যে অবশিষ্ট দুধ ৩ লিটারের পাত্রে থেকে যাবে তার পরিমাণ ১ লিটার।,"বেরু গোয়ালার কাছে একটি কলসিতে ১০ লিটার দুধ এবং দুধ মাপার দুটি খালি পাত্র , একটি ৫ লিটারের, অপরটি ৩ লিটারের। সে ক্রেতাকে ১ লিটার দুধ বিক্রি করতে চায়। গোয়ালার কাছে জেডযেসব পাত্র আছে শুধু তা দিয়ে কিভাবে ক্রেতাকে ১ লিটার দুধ দেয়া সম্ভব?","Beru the milkman has 10 liters of milk in a jar, and two empty containers: one of 5 liters and one of 3 liters. How can he measure exactly 1 liter using only these two containers?"
"একটি যৌথ পরিবারের মোট সদস্য (পুরুষ, মহিলা ও শিশু) ২০ জন। পরিবারের কর্তাবাবুর আদেশ ২০ মণ ধান পরিবারের সকল সদস্যের মধ্যে ভাগ করে দেয়া হবে। ভাগের নিয়ম হলঃ প্রত্যেক পুরুষ পাবে ৩ মণ, প্রত্যেক মহিলা পাবে ২ মণ, এবং প্রত্যেক শিশু পাবে ১ মণ ধান। প্রশ্ন হচ্ছে, কতজন করে ধান পাবে? অর্থাৎ পরিবারটির পুরুষ, মহিলাদের ও শিশুদের সংখ্যা কত?","১জন পুরুষ, ৫ জন মহিলা এবং ১৪ জন শিশু","একটি যৌথ পরিবারের মোট সদস্য (পুরুষ, মহিলা ও শিশু) ২০ জন। পরিবারের কর্তাবাবুর আদেশ ২০ মণ ধান পরিবারের সকল সদস্যের মধ্যে ভাগ করে দেয়া হবে। ভাগের নিয়ম হলঃ প্রত্যেক পুরুষ পাবে ৩ মণ, প্রত্যেক মহিলা পাবে ২ মণ, এবং প্রত্যেক শিশু পাবে ১ মণ ধান। প্রশ্ন হচ্ছে, কতজন করে ধান পাবে? অর্থাৎ পরিবারটির পুরুষ, মহিলাদের ও শিশুদের সংখ্যা কত?","A joint family has 20 members (men, women, and children). 20 mon of rice is to be divided where each man gets 3 mon, each woman 2 mon, and each child 1 mon. How many men, women, and children are there?"
দুই অঙ্কেরএকটি সংখ্যার তিন ভাগের এক ভাগ ও চার ভাগের এক ভাগের যোগফল ১৪ ।সংখ্যাটি কত হিসাবটি করো।,24,দুই অঙ্কেরএকটি সংখ্যার তিন ভাগের এক ভাগ ও চার ভাগের এক ভাগের যোগফল ১৪ ।সংখ্যাটি কত হিসাবটি করো।,The sum of one-third and one-fourth of a two-digit number is 14. What is the number?
"একটি ৫০০ মিটার লম্বা ট্রেনের গতি ৬০ কিলোমিটার হলে ,অর্ধকিলোমীটার লম্বা একটি সেতু পাড়ি দিতে ট্রেনটির কতক্ষণ সময় লাগবে?",১ মিনিট,"একটি ৫০০ মিটার লম্বা ট্রেনের গতি ৬০ কিলোমিটার হলে ,অর্ধকিলোমীটার লম্বা একটি সেতু পাড়ি দিতে ট্রেনটির কতক্ষণ সময় লাগবে?",A train 500 meters long moves at 60 km/h. How long will it take to cross a bridge 500 meters long?
"১টি পার্কে ১/৩ ভাগ নারকেলগাছ, ১/৪ গাছআম গাছ, ১/৫ ভাগ বট গাছ এবং ৩৯টি ফুলের গাছ। বাগানে কোন গাছ কতটি রয়েছে এবং মোট গাছ কয়টি ?","নারিকেল গাছ 60টি, আম গাছ ৪৫টি, বট গাছ ৩৬টি, ফুলের গাছ ৩৯টি","১টি পার্কে ১/৩ ভাগ নারকেলগাছ, ১/৪ গাছআম গাছ, ১/৫ ভাগ বট গাছ এবং ৩৯টি ফুলের গাছ। বাগানে কোন গাছ কতটি রয়েছে এবং মোট গাছ কয়টি ?","In a park, 1/3 are coconut trees, 1/4 are mango trees, 1/5 are banyan trees, and there are 39 flower trees. How many trees of each type and total trees are there?"
২০ গ্রাম লবণ দিয়ে ১০% লবণমিশ্রিত শরবত বানাতে কত লিটার পানির দরকার?,১.৮ লিটার,২০ গ্রাম লবণ দিয়ে ১০% লবণমিশ্রিত শরবত বানাতে কত লিটার পানির দরকার?,How many liters of water are needed to make 10% salt solution with 20 grams of salt?
৩০ কে ১/২ দিয়ে ভাগ করে ১০ যোগ করলে কত হয়?,70,৩০ কে ১/২ দিয়ে ভাগ করে ১০ যোগ করলে কত হয়?,Divide 30 by ½ and add 10. What is the result?
ডাক্তার এক রোগিকে সকাল ৬টা থেকে দুপুর ১২টা পর্যন্ত আধ ঘন্টা পরপর ১টি টেবলেট খেতে বললেন। রোগীর মোট কতটি টেবলেট প্রয়োজন?,১৩ টা,ডাক্তার এক রোগিকে সকাল ৬টা থেকে দুপুর ১২টা পর্যন্ত আধ ঘন্টা পরপর ১টি টেবলেট খেতে বললেন। রোগীর মোট কতটি টেবলেট প্রয়োজন?,A doctor advises a patient to take one tablet every 30 minutes from 6 AM to 12 PM. How many tablets are needed?
"A - B = 10, AB = 16 হলে A² + B² = কত?",132,"A - B = 10, AB = 16 হলে A² + B² = কত?","If A - B = 10 and AB = 16, what is A² + B²?"
"জমির ১৯৮৪ সালের ফেব্রুয়ারির ১০০ মাস পরে জন্মগ্রহণ করেছিল।
 জমিরের জন্মদিন কোন মাসে?",জুন মাসে,"""জমির ১৯৮৪ সালের ফেব্রুয়ারির ১০০ মাস পরে জন্মগ্রহণ করেছিল। জমিরের জন্মদিন কোন মাসে?""",Zamir was born 100 months after February 1984. In which month was he born?
"১ থেকে ১০০০ পর্যন্ত সংখ্যাগুলোর যোগফল কত?
 (১+২+৩+...+৯৯৮+৯৯৯+১০০০ = ?)",500500,"""১ থেকে ১০০০ পর্যন্ত সংখ্যাগুলোর যোগফল কত? (১+২+৩+...+৯৯৮+৯৯৯+১০০০ = ?)""",What is the sum of numbers from 1 to 1000?
"নিচের সিরিজের শেষ সংখ্যাটি কত?
 ২, ৫, ১১, ২৩, ৫৭, ?",125,"""নিচের সিরিজের শেষ সংখ্যাটি কত? ২, ৫, ১১, ২৩, ৫৭, ?""","What is the next number in the series: 2, 5, 11, 23, 57, ?"
একটি ঝুরিতে ধারণক্ষমতা ১২০টি আনারস অথবা ১৪৪টি আমের । ঝুড়িতে ৯০টি আনারস রাখার পর আর কতটি আম রাখা যাবে?,৩৬টি,একটি ঝুরিতে ধারণক্ষমতা ১২০টি আনারস অথবা ১৪৪টি আমের । ঝুড়িতে ৯০টি আনারস রাখার পর আর কতটি আম রাখা যাবে?,"A basket can hold 120 pineapples or 144 mangoes. If 90 pineapples are stored, how many mangoes can still be added?"
কারিম সাহেবের ৩ পুত্র এবং প্রথম ২ জন যমজ । ৩ পুত্রের বর্তমান বয়সের সমষ্টি ২৯ বছর। ৬ বছর পূর্বে তাদের বয়সের সমষ্টি ছিল ১২ বছর। পুত্রদের বর্তমান বয়স কত?,"১২, ১২, ৩ বছর",কারিম সাহেবের ৩ পুত্র এবং প্রথম ২ জন যমজ । ৩ পুত্রের বর্তমান বয়সের সমষ্টি ২৯ বছর। ৬ বছর পূর্বে তাদের বয়সের সমষ্টি ছিল ১২ বছর। পুত্রদের বর্তমান বয়স কত?,"Mr. Karim has 3 sons, the first two are twins. The total age of the sons now is 29 years, and 6 years ago it was 12 years. What are their current ages?"