Questions,Answer,Math Problem (Bengali),Math Problem (English)
৫৫০ টাকাকে ৫:৬ অনুপাতে ভাগ করলে প্রথম অংশ কত হবে,২৫০ টাকা,৫৫০ টাকাকে ৫:৬ অনুপাতে ভাগ করলে প্রথম অংশ কত হবে,"If 550 Taka is divided in a 5:6 ratio, what is the first part?"
দুই বন্ধুর বাড়ি থেকে স্কুলের দূরত্বের অনুপাত ২:৩ এবং প্রথম বন্ধুর দূরত্ব ৫ কিমি হলে দ্বিতীয় বন্ধুর দূরত্ব কত,৭.৫ কিমি,দুই বন্ধুর বাড়ি থেকে স্কুলের দূরত্বের অনুপাত ২:৩ এবং প্রথম বন্ধুর দূরত্ব ৫ কিমি হলে দ্বিতীয় বন্ধুর দূরত্ব কত,"The ratio of the distances of two friends from school is 2:3. If the first friend is 5 km away, what is the second friend’s distance?"
৪০% কে সাধারণ ভগ্নাংশে প্রকাশ করলে কী হয়,২/৫,৪০% কে সাধারণ ভগ্নাংশে প্রকাশ করলে কী হয়,What is 40% expressed as a proper fraction?
১৫০% কে দশমিক ভগ্নাংশে প্রকাশ করলে কী হয়,1.5,১৫০% কে দশমিক ভগ্নাংশে প্রকাশ করলে কী হয়,What is 150% expressed as a decimal?
২৫ টাকা ১২৫ টাকার শতকরা কত,20%,২৫ টাকা ১২৫ টাকার শতকরা কত,25 Taka is what percent of 125 Taka?
একটি কলম ২০% লাভে ২৪ টাকায় বিক্রয় করলে ক্রয়মূল্য কত,২০ টাকা,একটি কলম ২০% লাভে ২৪ টাকায় বিক্রয় করলে ক্রয়মূল্য কত,"If a pen is sold for 24 Taka with 20% profit, what was the cost price?"
একটি বই ১৫% কমিশনে ১৭০ টাকায় বিক্রয় করলে প্রকৃত মূল্য কত,২০০ টাকা,একটি বই ১৫% কমিশনে ১৭০ টাকায় বিক্রয় করলে প্রকৃত মূল্য কত,"If a book is sold at 15% commission for 170 Taka, what is its actual price?"
৬ জন লোক একটি কাজ ২৮ দিনে করলে ২৪ জন লোক কত দিনে করবে,৭ দিন,৬ জন লোক একটি কাজ ২৮ দিনে করলে ২৪ জন লোক কত দিনে করবে,"If 6 people complete a task in 28 days, how many days will 24 people take?"
একটি কাজ ক ১০ দিনে ও খ ১৫ দিনে করলে তারা একত্রে কত দিনে করবে,৬ দিন,একটি কাজ ক ১০ দিনে ও খ ১৫ দিনে করলে তারা একত্রে কত দিনে করবে,"If A can do a job in 10 days and B in 15 days, how many days will they take together?"
১০টি বলপেনের দাম ৬০ টাকা হলে ২টি বলপেনের দাম কত,১২ টাকা,১০টি বলপেনের দাম ৬০ টাকা হলে ২টি বলপেনের দাম কত,"If 10 pens cost 60 Taka, what is the cost of 2 pens?"
১ ডজন ডিমের দাম ৪৮ টাকা হলে ১৬টি ডিমের দাম কত,৬৪ টাকা,১ ডজন ডিমের দাম ৪৮ টাকা হলে ১৬টি ডিমের দাম কত,"If 1 dozen eggs cost 48 Taka, what is the cost of 16 eggs?"
কাজের পরিমাণ অপরিবর্তিত থাকলে লোক সংখ্যা বাড়ালে সময় কী হয়,সময় কমে যায়,কাজের পরিমাণ অপরিবর্তিত থাকলে লোক সংখ্যা বাড়ালে সময় কী হয়,"If the amount of work remains the same, what happens to time if the number of workers increases?"
৭ কেজি চালের দাম ২৮০ টাকা হলে ১৫ কেজি চালের দাম কত,৬০০ টাকা,৭ কেজি চালের দাম ২৮০ টাকা হলে ১৫ কেজি চালের দাম কত,"If 7 kg of rice costs 280 Taka, what is the cost of 15 kg?"
একটি ছাত্রাবাসে ৫০ জনের ১৫ দিনের খাদ্য মজুদ আছে। ঐ খাদ্যে ২৫ জনের কত দিন চলবে,৩০ দিন,একটি ছাত্রাবাসে ৫০ জনের ১৫ দিনের খাদ্য মজুদ আছে। ঐ খাদ্যে ২৫ জনের কত দিন চলবে,A hostel has food for 50 people for 15 days. How many days will it last for 25 people?
৯০০০ টাকা বিনিয়োগে প্রতিদিন ৪৫০ টাকা লাভ হলে ৬০০ টাকা লাভ করতে কত বিনিয়োগ করতে হবে,১২০০০ টাকা,৯০০০ টাকা বিনিয়োগে প্রতিদিন ৪৫০ টাকা লাভ হলে ৬০০ টাকা লাভ করতে কত বিনিয়োগ করতে হবে,"If an investment of 9000 Taka yields 450 Taka profit per day, how much should be invested to earn 600 Taka per day?"
১২০ কেজি চালে ১০ জন লোকের ২৭ দিন চলে। ৪৫ দিন চলতে কত কেজি চাল প্রয়োজন হবে,২০০ কেজি,১২০ কেজি চালে ১০ জন লোকের ২৭ দিন চলে। ৪৫ দিন চলতে কত কেজি চাল প্রয়োজন হবে,120 kg of rice lasts 10 people for 27 days. How much rice is needed to last 45 days?
২ কুইন্টাল চালে ১৫ জন ছাত্রের ৩০ দিন চলে। ঐ চালে ২০ জন ছাত্রের কত দিন চলবে,২২ ১/২ দিন,২ কুইন্টাল চালে ১৫ জন ছাত্রের ৩০ দিন চলে। ঐ চালে ২০ জন ছাত্রের কত দিন চলবে,2 quintals of rice last 15 students for 30 days. How many days will it last for 20 students?
একটি বাঁধ তৈরি করতে ৩৬০ জন শ্রমিকের ২৫ দিন লাগে। ১৮ দিনে কাজটি শেষ করতে কতজন অতিরিক্ত শ্রমিক লাগবে,১৪০ জন,একটি বাঁধ তৈরি করতে ৩৬০ জন শ্রমিকের ২৫ দিন লাগে। ১৮ দিনে কাজটি শেষ করতে কতজন অতিরিক্ত শ্রমিক লাগবে,"To build a dam, 360 workers are needed for 25 days. How many extra workers are needed to finish it in 18 days?"
২৫ জন লোক দৈনিক ৬ ঘণ্টা পরিশ্রম করে একটি কাজ ৮ দিনে শেষ করে। ১০ জন লোক দৈনিক কত ঘণ্টা পরিশ্রম করে ঐ কাজটি শেষ করবে,১৫ ঘণ্টা,২৫ জন লোক দৈনিক ৬ ঘণ্টা পরিশ্রম করে একটি কাজ ৮ দিনে শেষ করে। ১০ জন লোক দৈনিক কত ঘণ্টা পরিশ্রম করে ঐ কাজটি শেষ করবে,25 people working 6 hours a day complete a job in 8 days. How many hours per day must 10 people work to complete the same job?
একটি কাজ ২ জন পুরুষ অথবা ৩ জন বালক সম্পন্ন করতে পারে। ৯ জন বালক কতজন পুরুষের সমান কাজ করতে পারবে,৬ জন পুরুষ,একটি কাজ ২ জন পুরুষ অথবা ৩ জন বালক সম্পন্ন করতে পারে। ৯ জন বালক কতজন পুরুষের সমান কাজ করতে পারবে,A task can be completed by 2 men or 3 boys. How many men are equivalent to 9 boys?
একটি আয়তাকার বাগানের দৈর্ঘ্য প্রস্থের তিনগুণ এবং পরিসীমা ৪০০ মিটার হলে বাগানের দৈর্ঘ্য কত,১৫০ মিটার,একটি আয়তাকার বাগানের দৈর্ঘ্য প্রস্থের তিনগুণ এবং পরিসীমা ৪০০ মিটার হলে বাগানের দৈর্ঘ্য কত,"In a rectangular garden, the length is three times the width and the perimeter is 400 meters. What is the length?"
একটি আয়তাকার বাগানের দৈর্ঘ্য ১৫০ মিটার ও প্রস্থ ৫০ মিটার হলে ক্ষেত্রফল কত,৭৫০০ বর্গমিটার,একটি আয়তাকার বাগানের দৈর্ঘ্য ১৫০ মিটার ও প্রস্থ ৫০ মিটার হলে ক্ষেত্রফল কত,"If the length of a rectangular garden is 150 meters and width is 50 meters, what is the area?"
একটি জমির দৈর্ঘ্য ২০ মিটার ও প্রস্থ ১৫ মিটার হলে তার পরিসীমা কত,৭০ মিটার,একটি জমির দৈর্ঘ্য ২০ মিটার ও প্রস্থ ১৫ মিটার হলে তার পরিসীমা কত,"If a plot is 20 meters long and 15 meters wide, what is its perimeter?"
জমির ভিতরে ২ মিটার চওড়া রাস্তা থাকলে রাস্তাবাদে জমির ক্ষেত্রফল কত,১৭৬ বর্গমিটার,জমির ভিতরে ২ মিটার চওড়া রাস্তা থাকলে রাস্তাবাদে জমির ক্ষেত্রফল কত,"If there is a 2-meter-wide path inside the land, what is the area of the land including the path?"
একটি ত্রিভুজের ভূমি ১০ মিটার ও উচ্চতা ৬ মিটার হলে ক্ষেত্রফল কত,৩০ বর্গ মিটার,একটি ত্রিভুজের ভূমি ১০ মিটার ও উচ্চতা ৬ মিটার হলে ক্ষেত্রফল কত,"If a triangle has a base of 10 meters and height of 6 meters, what is its area?"
এক খন্ড জমিতে ৫০০ কেজি ৭০০ গ্রাম আলু হলে ১১ খন্ড জমিতে কত আলু হবে,৫ মেট্রিক টন ৫০৭ কেজি ৭০০ গ্রাম,এক খন্ড জমিতে ৫০০ কেজি ৭০০ গ্রাম আলু হলে ১১ খন্ড জমিতে কত আলু হবে,"If one plot yields 500 kg 700 g of potatoes, how much will 11 plots yield?"
১৬ একর জমিতে ২৮ মেট্রিক টন ধান হলে প্রতি একর জমিতে কী পরিমাণ ধান ফলে,১ মেট্রিক টন ৭৫০ কেজি,১৬ একর জমিতে ২৮ মেট্রিক টন ধান হলে প্রতি একর জমিতে কী পরিমাণ ধান ফলে,"If 16 acres of land yield 28 metric tons of paddy, how much paddy per acre?"
এক মাসে ২০০০০ মেট্রিক টন রড তৈরি হলে দৈনিক কী পরিমাণ রড তৈরি হয়,৬৬৬ মেট্রিক টন ৬৬৬ কেজি ৬৬৬ গ্রাম (প্রায়),এক মাসে ২০০০০ মেট্রিক টন রড তৈরি হলে দৈনিক কী পরিমাণ রড তৈরি হয়,"If 20,000 metric tons of rods are produced in a month, how much is produced daily?"
একটি আয়তাকার বাগানের দৈর্ঘ্য ৬০ মিটার ও প্রস্থ ৪০ মিটার। এর ভিতরে ২ মিটার চওড়া রাস্তা থাকলে রাস্তার ক্ষেত্রফল কত,৩৮৪ বর্গ মিটার,একটি আয়তাকার বাগানের দৈর্ঘ্য ৬০ মিটার ও প্রস্থ ৪০ মিটার। এর ভিতরে ২ মিটার চওড়া রাস্তা থাকলে রাস্তার ক্ষেত্রফল কত,"A rectangular garden is 60m by 40m. If there’s a 2m wide path inside, what is the area of the path?"
একটি ঘরের মেঝে কার্পেট দিয়ে মুড়তে প্রতি বর্গমিটারে ৭.৫০ টাকা দরে ১১০২.৫০ টাকা খরচ হলে ঘরের ক্ষেত্রফল কত,১৪৭ বর্গমিটার,একটি ঘরের মেঝে কার্পেট দিয়ে মুড়তে প্রতি বর্গমিটারে ৭.৫০ টাকা দরে ১১০২.৫০ টাকা খরচ হলে ঘরের ক্ষেত্রফল কত,"If carpeting a floor costs 7.50 Taka per sq. meter and the total cost is 1102.50 Taka, what is the area of the floor?"
একটি ঘরের দৈর্ঘ্য প্রস্থের তিনগুণ এবং ক্ষেত্রফল ১৪৭ বর্গমিটার হলে ঘরটির দৈর্ঘ্য কত,২১ মিটার,একটি ঘরের দৈর্ঘ্য প্রস্থের তিনগুণ এবং ক্ষেত্রফল ১৪৭ বর্গমিটার হলে ঘরটির দৈর্ঘ্য কত,"If a room's length is three times its width and the area is 147 sq. meters, what is the length?"
একটি আয়তাকার বাগানের দৈর্ঘ্য ৫০ মি ও প্রস্থ ৩০ মি। এর ভিতরে ৩ মিটার চওড়া রাস্তা থাকলে রাস্তার ক্ষেত্রফল কত,৪৪৪ বর্গমিটার,একটি আয়তাকার বাগানের দৈর্ঘ্য ৫০ মি ও প্রস্থ ৩০ মি। এর ভিতরে ৩ মিটার চওড়া রাস্তা থাকলে রাস্তার ক্ষেত্রফল কত,"A rectangular garden is 50m by 30m. If there’s a 3m wide path inside, what is the area of the path?"
রাস্তাবাদে বাগানের পরিসীমায় বেড়া দিতে প্রতি মিটারে ২৫ টাকা হিসেবে মোট কত খরচ হবে যদি রাস্তাবাদে বাগানের দৈর্ঘ্য ৪৪ মি ও প্রস্থ ২৪ মি হয়,৩৪০০ টাকা,রাস্তাবাদে বাগানের পরিসীমায় বেড়া দিতে প্রতি মিটারে ২৫ টাকা হিসেবে মোট কত খরচ হবে যদি রাস্তাবাদে বাগানের দৈর্ঘ্য ৪৪ মি ও প্রস্থ ২৪ মি হয়,"If the garden including the path is 44m by 24m, and fencing costs 25 Taka per meter, what is the total cost?"
একটি বাগানের বাইরে ২.৫ মিটার চওড়া রাস্তা থাকলে রাস্তার ক্ষেত্রফল কত যদি বাগানের দৈর্ঘ্য ৫০ মি ও প্রস্থ ৩৫ মি হয়,৪৫০ বর্গমিটার,একটি বাগানের বাইরে ২.৫ মিটার চওড়া রাস্তা থাকলে রাস্তার ক্ষেত্রফল কত যদি বাগানের দৈর্ঘ্য ৫০ মি ও প্রস্থ ৩৫ মি হয়,"If a 2.5m wide path surrounds a garden of 50m by 35m, what is the area of the path?"
রাস্তাসহ বাগানের পরিসীমা ১৯০ মিটার হলে সমান পরিসীমা বিশিষ্ট বর্গাকার মাঠের ক্ষেত্রফল কত,২২৫৬.২৫ বর্গমিটার,রাস্তাসহ বাগানের পরিসীমা ১৯০ মিটার হলে সমান পরিসীমা বিশিষ্ট বর্গাকার মাঠের ক্ষেত্রফল কত,"If the total perimeter (including path) of a garden is 190m, what is the area of a square field with the same perimeter?"
একটি সামান্তরিকের ভূমি ৯০ গজ ও উচ্চতা ৫০ গজ হলে তার ক্ষেত্রফল কত,৪৫০০ বর্গগজ,একটি সামান্তরিকের ভূমি ৯০ গজ ও উচ্চতা ৫০ গজ হলে তার ক্ষেত্রফল কত,"If a parallelogram has a base of 90 yards and height of 50 yards, what is its area?"
সামান্তরিকের মেঝে পাথর দ্বারা ঢাকতে কতটি পাথর লাগবে যদি মেঝের ক্ষেত্রফল ৪৫০০ বর্গগজ ও পাথরের ক্ষেত্রফল ৪ বর্গগজ হয়,১১২৫টি,সামান্তরিকের মেঝে পাথর দ্বারা ঢাকতে কতটি পাথর লাগবে যদি মেঝের ক্ষেত্রফল ৪৫০০ বর্গগজ ও পাথরের ক্ষেত্রফল ৪ বর্গগজ হয়,"To cover a parallelogram floor of 4500 sq. yards with stones each covering 4 sq. yards, how many stones are needed?"
একটি বাগানের পরিসীমা ১২০ মিটার হলে চারদিকে বেড়া দিতে কত খরচ হবে যদি প্রতি মিটারে খরচ ৩১/৪ টাকা হয়,৯৩০ টাকা,একটি বাগানের পরিসীমা ১২০ মিটার হলে চারদিকে বেড়া দিতে কত খরচ হবে যদি প্রতি মিটারে খরচ ৩১/৪ টাকা হয়,"If the perimeter of a garden is 120 meters and fencing costs 3¼ Taka per meter, what is the total fencing cost?"
৬০ মিটার দীর্ঘ আয়তাকার বাগানের দৈর্ঘ্য প্রস্থের ৩ গুণ হলে প্রস্থ কত,২০ মিটার,৬০ মিটার দীর্ঘ আয়তাকার বাগানের দৈর্ঘ্য প্রস্থের ৩ গুণ হলে প্রস্থ কত,A rectangular garden is 60 meters long and the length is 3 times the width. What is the width?
একটি বর্গক্ষেত্রের পরিসীমা ১৬০ মিটার হলে তার ক্ষেত্রফল কত,১৬০০ বর্গমিটার,একটি বর্গক্ষেত্রের পরিসীমা ১৬০ মিটার হলে তার ক্ষেত্রফল কত,"If a square has a perimeter of 160 meters, what is its area?"
"২ বছর পর জীবনের বয়স হবে, ২ বছর পূর্বে জীবনের বয়স যা ছিল তার দ্বিগুণ। ৩ বছর পর জীবনের বয়স যদি ৩ বছর পূর্বে জীবনের বয়সের সমান হয়, তবে কার বয়স বেশি, জীবনের নাকি জুলির?",দুইজনের বয়স সমান,"২ বছর পর জীবনের বয়স হবে, ২ বছর পূর্বে জীবনের বয়স যা ছিল তার দ্বিগুণ। ৩ বছর পর জীবনের বয়স যদি ৩ বছর পূর্বে জীবনের বয়সের সমান হয়, তবে কার বয়স বেশি, জীবনের নাকি জুলির?","In 2 years, Jibon’s age will be twice what it was 2 years ago. In 3 years, Jibon’s age will equal what it was 3 years ago. Who is older—Jibon or Julie?"
৫টি আপেলকে ৬ জন বালকের মাঝে সমানভাবে ভাগ করে দিতে হবে। কিভাবে? (বি: দ্র: প্রয়োজন হলে আপেলকে সর্বোচ্চ সমান ৩ টুকরাতে কাটা যাবে।),প্রতেকে পাবে ৫/৬ আপেল।অর্থাৎ ১টি আপেলের অর্ধেক +১টি আপেলের ১/৩ ভাগ।,৫টি আপেলকে ৬ জন বালকের মাঝে সমানভাবে ভাগ করে দিতে হবে। কিভাবে? (বি: দ্র: প্রয়োজন হলে আপেলকে সর্বোচ্চ সমান ৩ টুকরাতে কাটা যাবে।),How can 5 apples be divided equally among 6 boys? (Note: Each apple can be cut into up to 3 equal pieces.)
৪টি কাঁঠাল এবং ৫টি তরমুজের ওজনের সমষ্টি ৩২কিলোগ্রাম। ৫টি কাঠাল এবং ৪টি তরমুজের ওজনের সমষ্টি ৩১ কিলোগ্রাম। উপরের সব কাঠালের ওজন সমান এবং সব তরমুজের ওজন সমান । ১ কাঠাল ও ১ তরমুজের ওজন কত?,"কাঠালের ওজন ৩ কিলোগ্রাম , তরমুজের ওজন ৪ কিলোগ্রাম",৪টি কাঁঠাল এবং ৫টি তরমুজের ওজনের সমষ্টি ৩২কিলোগ্রাম। ৫টি কাঠাল এবং ৪টি তরমুজের ওজনের সমষ্টি ৩১ কিলোগ্রাম। উপরের সব কাঠালের ওজন সমান এবং সব তরমুজের ওজন সমান । ১ কাঠাল ও ১ তরমুজের ওজন কত?,"The total weight of 4 jackfruits and 5 watermelons is 32 kg. The total weight of 5 jackfruits and 4 watermelons is 31 kg. If all jackfruits and all watermelons weigh the same, what is the weight of one jackfruit and one watermelon?"
